{
  "$schema": "https://json-schema.org/draft/2020-12/schema",
  "$id": "handoff-envelope.schema.json",
  "type": "object",
  "additionalProperties": false,
  "required": ["handoff_id","producer","consumer","task","status","risk","facts","hypotheses","decisions","evidence","open_questions","artifacts","verification"],
  "properties": {
    "handoff_id": {"type":"string","minLength":8},
    "producer": {"type":"string","minLength":1},
    "consumer": {"type":"string","minLength":1},
    "task": {"type":"string","minLength":1},
    "status": {"enum":["ready","blocked","failed","verified"]},
    "risk": {"type":"array","items":{"type":"string"},"uniqueItems":true},
    "facts": {"type":"array","items":{"$ref":"#/$defs/statement"}},
    "hypotheses": {"type":"array","items":{"$ref":"#/$defs/statement"}},
    "decisions": {"type":"array","items":{"$ref":"#/$defs/decision"}},
    "evidence": {"type":"array","items":{"$ref":"#/$defs/evidence"}},
    "open_questions": {"type":"array","items":{"type":"string"}},
    "artifacts": {"type":"array","items":{"$ref":"#/$defs/artifact"}},
    "verification": {"$ref":"#/$defs/verification"}
  },
  "$defs": {
    "statement": {"type":"object","additionalProperties":false,"required":["text","confidence"],"properties":{"text":{"type":"string","minLength":1},"confidence":{"type":"number","minimum":0,"maximum":1},"evidence_ids":{"type":"array","items":{"type":"string"},"default":[]}}},
    "decision": {"type":"object","additionalProperties":false,"required":["text","reason"],"properties":{"text":{"type":"string"},"reason":{"type":"string"},"approval_required":{"type":"boolean","default":false}}},
    "evidence": {"type":"object","additionalProperties":false,"required":["id","source","summary"],"properties":{"id":{"type":"string"},"source":{"type":"string"},"summary":{"type":"string"},"sha256":{"type":"string","pattern":"^[a-fA-F0-9]{64}$"}}},
    "artifact": {"type":"object","additionalProperties":false,"required":["path","sha256"],"properties":{"path":{"type":"string"},"sha256":{"type":"string","pattern":"^[a-fA-F0-9]{64}$"},"purpose":{"type":"string"}}},
    "verification": {"type":"object","additionalProperties":false,"required":["status","checks"],"properties":{"status":{"enum":["not-run","passed","failed","blocked"]},"checks":{"type":"array","items":{"type":"object","required":["name","status"],"properties":{"name":{"type":"string"},"status":{"enum":["passed","failed","skipped"]},"evidence":{"type":"string"}}}}}}
  }
}
